id,text,target
8149,world fear over miss migrants in med rescuers search for survivors after a boat carry as many a  news,1.0
8150,durbanknight rescuers be search for hundreds of migrants in the mediterranean after a boat carr  nosybe,1.0
8154,i have an unexplainable desire to watch the rescuers childhooddefined,0.0
8155,roddypiperautos fear over miss migrants in med rescuers search for survivors after a boat carry as ma,1.0
8156,andygilder channel 5 have be do the same for the rspca with dog rescuersthe infomercial have creep in the back door,0.0
8158,video be pick up body from water rescuers be search for hundreds of migrants in the mediterranean after a boat carryi,1.0
8159,womanûªs gps app guide rescuers to injure biker in marin county,1.0
8161,video be pick up body from water rescuers be search for hundreds of migrants in the mediterran,1.0
8162,video be pick up body from water rescuers be search for hundreds of migrants in the mediterran,1.0
8163,video be pick up body from water rescuers be search for hundreds of migrants in the mediterranean after a boat carryi,1.0
8164,video be pick up body from water rescuers be search for hundreds of migrants in   africa news,1.0
8165,last second ebay bid rt  shaolin rescuers dvd 2010 shen chan nan chiang five venoms kung fu please favori,0.0
8168,video be pick up body from water rescuers be search for hundreds of migrants in the mediterranean after a boat carryi,1.0
8169,"worldnews
 video be pick up body from water  bbc news  home
rescuers be search for hundreds of",1.0
8170,video be pick up body from water rescuers be search for hundreds of migrants in the mediterran,1.0
8171,video be pick up body from water rescuers be search for hundredsû,1.0
8172,ahmazing story of the power animal rescuers have a starve homeless dog with no future be rescue by a person,1.0
8175,rescuers be search for hundreds of migrants in the mediterranean after a boat carry as many as 600 people capsize off the coast ofû,1.0
8176,news many deaths in shipwreck rescuers be try to save hundreds of migrants after the  via thenewshype,1.0
8177,video be pick up body from water rescuers be search for hundreds of migrants in the mediterran,1.0
8180,video be pick up body from water rescuers be search for hundreds of migrants in the mediterran,1.0
8181,when rescuers find him he be barely alive but they have no idea he be allergic to this,1.0
8182,fear over miss migrants in med rescuers search for survivors after a boat carry as many as 600 migrant,1.0
8183,video be pick up body from water rescuers be search for hundreds of migrants in the mediterranean after a boat carryi,1.0
8184,womans gps app guide rescuers to injure biker in marin county  sfgate,1.0
8187,fear over miss migrants in med rescuers search for survivors after a boat carry as many as 600 migrantsû,1.0
8188,rescuers find survivors of nepal earthquake bury,1.0
8189,"rescuers recover body of 37yearold calgary man from lake near vulcan 
                            
             û",1.0
8190,fear over miss migrants in med rescuers search for survivors after a boat carry as many as 600 migrantsû,1.0
8191,video be pick up body from water rescuers be search for hundreds of migrants in the  bbc news,1.0
8195,to all the meatloving feminists of the world riot grill have arrive pop quiz which do you prefer fem  art,0.0
8196,stuart broad take eight before joe root run riot against aussies,0.0
8201,piprhys i predict a riot,1.0
8202,"teamvodg discover by nickcannon 
 listenbuy realmandyrain riot on itunesmusic itunes  û blowmandyup",0.0
8203,to all the meatloving feminists of the world riot grill have arrive  arts,0.0
8204,rascal flatts riot tour atlantic city beach concertaugust 20 20152 ticket,0.0
8205,to all the meatloving feminists of the world riot grill hasåêarrived,0.0
8208,seriously do we have to do a tactical riot against the headquarter of disney and marvel,0.0
8209,daniriot keep an eye out well be look for lot of new team members in come daysweeks,0.0
8210,to all the meatloving feminists of the world riot grill have arrive pop quiz which do you prefer feminist,0.0
8211,liveworkshop selfie at booth or riot kappa,1.0
8212,acaciapenn ill start a big ass riot  send me to jail today mfs shidddd,0.0
8213,"riot kit bah  part of the new concept gear come for autumnwinter
menswear fashion urbanfashionû",0.0
8214,"abrancaballero discover by nickcannon 
 listenbuy realmandyrain riot on itunesmusic itunes  û blowmandyup",0.0
8215,i like a youtube video  thorins thoughts  riot and sandbox mode lol,0.0
8216,stuart broad take eight before joe root run riot against aussies stuart broad take careerbest figure of 8,0.0
8217,"retweeted sarah silverman sarahksilverman

soundtrack of my walk start w tracey ullman they dont know  perfect",0.0
8218,to all the meatloving feminists of the world riot grill have arrive,1.0
8219,after all that time riot should really make an official satan teemo skin,0.0
8221,i like a youtube video  sick riot shield slide spot,0.0
8223,bytorrecilla torrecilla we always info the secret on lol game check the secret to get 600000 riot point on my bio,0.0
8224,transwomen and drag queen of color lead the riot a well know butch lesbian be usually credit for incite it,0.0
8225,eac4au you can now preorder the film on itunes amp watch 915 yay,0.0
8226,without an ally near you cant use this skill how do you get hire really cause its make every riot staff member look incompetent,0.0
8231,pop quiz which do you prefer feminist revolution or fry ravioliåêwith porcini and ricottaû,0.0
8232,to all the meatloving feminists of the world riot grill have arrive  oliviamiles01,0.0
8234,davidjordan88 stephanenny except we dont know who start the riot or if it even make sense to credit any particular individuals,1.0
8235,trollkrattos juan carlos salvador the secret tip to get 100000 riot point lol be out now check the secret on on my bio,0.0
8236,southeast dirt riot series crown champion  southeast dirt riot series crown championsblackfoot id the so,0.0
8237,sweetpeas be run riot at the allotment  and brighten up a rainy day,1.0
8238,stuart broad take eight before joe root run riot against aussies,0.0
8239,riot police intervene after southampton and vitesse arnhem supporters clash û¢ fan clash in buildup to second,1.0
8240,"jwalkerlyle discover by nickcannon 
 listenbuy realmandyrain riot on itunesmusic itunes  û blowmandyup",0.0
8241,cracker  white riot   nowplaying,0.0
8242,but the government will not care police will stop riot eventually of protestors eventually some skyscrapers become plantcovered,1.0
8243,new doco tonight at 9pm setanta sport ireland freeview the largest police presence at a soccer game in ireland stop prevent the riot,0.0
8244,eric clapton shoot the sheriff in 1974 and guess how many people be riot right none,1.0
8245,if they kill off val im riot emmerdale,0.0
8246,money cant buy happiness be just a lie we tell poor people to keep them from riot,1.0
8247,bloody hell its already be upgrade to riot hyperbole saintsfc,1.0
8250,twitter be do a count down to the riot and financial collapse of brazil rio2016,1.0
8251,if that would of be a black dude antioch would be riot,0.0
8252,runjewels recently meet with the bbc to discuss race relations in america amp the benefit of riot loveislove,0.0
8253,reuters people like you should be charge after the inevitable riot for contribute to it with your lie,0.0
8254,cindy noonancindynoonanheartbreak in baltimore riot yahistorical undergroundrailraod,1.0
8256,leeds fan riot in embra at a lower tier league cup final  dee dum,1.0
8257,still riot in a couple of hours leave until i have to be up for class,1.0
8258,cloydrivers there be plenty of black people riot when tosu win the championship as well,0.0
8259,"evacide the ferguson riot work this of this the next time you say riot doesnt change anything

there fix it for you",1.0
8261,bbcnews the ass of british insurers say riot will cost insurers  amp163163millions but police number be reduce by blind fat contr,1.0
8262,bhramabull watch run the jewel use facts to defend riot in ferguson the socially mind duo take on the,1.0
8264,i think twitter be invent to keep us insomniacs from riot in the wee small hours,0.0
8266,blutz10 people arent riot because justice have be serve and that murderer be behind bar simple no justiceno peace justicepeace,1.0
8267,still riot in to gmail,0.0
8270,jasalhad brianboru67 jimskiv92 hijinks1967 riot,1.0
8271,ryleedowns02 nevaehburton33 if i dont get my money by tomorrow riot,0.0
8274,rt  why sweden isnt venezuela there have be a few days of riot in venezuela with the riot direct at grû,1.0
8276,davidolszak or the riot in happy valley after penn state lose,0.0
8278,aelinrhee a group of mascara smear girls riot will be horrific i think,1.0
8279,the last time a high profile name be due to be sign for nffc the city be riot wesley verhoek now a household name dontpanic,1.0
8280,georgous what alternatives legal alternatives protest riot may not be the most peaceful thing but its a demonstration of how,0.0
8283,halljh1720 i be so sick of criminals parent and friends riot when they be kill by police you dont give a damn when officer be,1.0
8284,blutz10 but the riot begin prior to the decision for the indictment so youre not really make sense at this pointû,1.0
8285,the ash test match be currently more interest than stupid congress riot,1.0
8286,"people riot everywhere and i think id be one of them

usamisan lt3",1.0
8287,football hooligan jail for riot before game in scotland be already ban from match in england uknews,1.0
8288,cindy noonancindynoonanheartbreak in baltimore riot yahistorical undergroundrailraod,0.0
8289,be bbcnews the ass british insurers say riot will cost insurers163millions but police number be reduce by blind fat controllers,1.0
8291,fa07af174a71408 i have live amp my family have live in countries where looters be shoot on sight where riot wasnt tolerate why here,1.0
8292,refuse to let my life be reduce to rubble when the shit keep pile up get a shovel expirehc,0.0
8294,chinas stock market crash be there gems in the rubble chinaûªs stock market crash this su    via forbes,0.0
8295,if you go on with this nuclear arm race all you be go to do be make the rubble bounce  winston churchill,0.0
8296,accionempresa chinaûªs stock market crash this summer have spark interest from bargain hunt  gerenciatodos å¨,1.0
8297,accionempresa chinaûªs stock market crash this summer have spark interest from bargain hunt  gerenciatodos å¨,0.0
8298,my parent be so impulsive sometimes i remember come home to my room fill with dust amp rubble just because they want it redesign,0.0
8300,turn rubble from disasters into lego bricks you can build house with this one belong in crazyideascollege,0.0
8301,360wisenews  chinas stock market crash be there gems in the rubble,0.0
8304,forbes chinas stock market crash be there gems in the rubble chinaûªs stock market crash this summer ha,0.0
8309,forbes europe chinas stock market crash be there gems in the rubble,1.0
8310,chinaûªs stock market crash this summer have spark interest from bargain hunters and bull bet on a rebound dû,0.0
8311,jasonpope2 johnfugelsang again i didnt say it be i be refer to the main 2 build 7 be hit by rubble,1.0
8312,chinas stock market crash be there gems in the rubble,0.0
8314,360wisenews  chinas stock market crash be there gems in the rubble,1.0
8315,jun 2015 yemenis search for survivors under the rubble of house in the old city of sanûªa follow an,1.0
8317,chinas stock market crash be there gems in the rubble  forbesasia,1.0
8318,steve buscemi be a firefightr b4 fame amp workd 12hr shift diggin thru wtc rubble lookg 4 survivors,1.0
8320,chinas stock market crash be there gems in the rubble  tcot p2 news,0.0
8321,chinas stock market crash be there gems in the rubble chinaûªs stock market crash this summer h  by forbes,0.0
8324,i find a diamond in the rubble,0.0
8329,tnn chinas stock market crash be there gems in the rubble,1.0
8330,chinas stock market crash be there gems in the rubble  roimentor yycwalks,1.0
8332,chinas stock market crash be there gems in the rubble,0.0
8334,360wisenews  chinas stock market crash be there gems in the rubble,1.0
8335,new post chinas stock market crash be there gems in the rubble,0.0
8337,chinas stock market crash be there gems in the rubble chinaûªs stock market crash this summer have spark,0.0
8339,photo postapocalypticflimflam prod around the rubble,0.0
8341,360wisenews  chinas stock market crash be there gems in the rubble,0.0
8344,okgabby damn suh dont let that ruin your year bruh this our year better start carpooling like we do back in the day,0.0
8345,if i cant ruin his mood then i may have lose my direction,0.0
8346,i ruin everything,0.0
8347,quote never let your problems ruin your faith,0.0
8348,im so anxious though because so many ppl will me watch me meet them and that make me uncomfortable but i cant let that ruin the moment,0.0
8349,smokers that ruin that new car smell,0.0
8350,chrisdyson16 just wait until your friends at mta ruin it sorrybutitstrue,0.0
8351,im really sad about red 7 close  yuppies n tourists ruin everything,0.0
8352,always gotta ruin my mood,0.0
8355,i understand you want to hang out with your guy friends ill give you your space but dont ruin my trust with you,0.0
8356,like why on earth would you want anybody to be unhappy dont purposely ruin somebody elses happiness,0.0
8360,fresh out da shower look  still love this new hair do it ruin my brand yes,0.0
8361,savannahross4 see tryna ruin my life,0.0
8362,well do me everyone applaud me and how terrific i be and how i never ruin anything,0.0
8363,four things that may ruin your personal injury accident claim,1.0
8364,how to ruin the holiday in 3 wordk its a zmne,0.0
8365,every time i have a really good day someone just have to ruin it,0.0
8366,you wanna ruin a relationship just ask what be your intentions and youll do it,0.0
8367,and then i go a ruin it all with something awful minions,0.0
8368,it be really awful and i cant even work with a make up artist now because they will ruin things,0.0
8369,damn wale know how to ruin a song,0.0
8370,cause you play me like a symphony play me till your finger bleed im your greatest masterpiece you ruin me,0.0
8371,why do my family have to ruin something that be actually go good for me,0.0
8372,i hate that im so awkward and i ruin things,0.0
8374,long road to ruin  foo fighters,0.0
8375,why do u ruin everything  9tarbox u ruin the sour cream and u put a brick of cheese in the freezerdummy,0.0
8377,dont let a few assholes ruin your night,0.0
8378,lol the real issue be the the way the nfl be try to ruin this guy legacy,0.0
8382,rt to ruin connormidd s day,0.0
8383,greedy bastards fullscreen way to ruin creativity  censorship on youtube,0.0
8385,juliechen she shouldnt be with them be gonna ruin her game and vanessa be a great player,0.0
8386,clnv yes yes i will i dont wanna ruin my life lol,0.0
8387,nbc i wanna see you reboot the fresh prince of belair bring back the original cast and everything amp do nothing that will ruin the show,0.0
8388,you can only make yourself happy fuck those tryna ruin it keep smile,0.0
8389,there be a few people id let ruin my life my soul my cervix my everything odell be definitely top of that list,0.0
8390,ill ruin my life if i have to,0.0
8391,babe im gonna ruin you if you let me stay,0.0
8392,ctaztrophe31 everything must be ok because shes listen to sandstorm now,0.0
8393,watch this airport get swallow up by a sandstorm in under a minute,1.0
8394,watch this airport get swallow up by a sandstorm in under a minute,1.0
8396,hienshi gbay99 it wouldnt turn into a sandstorm if riot give a good answer  instead they give dumb excuse at least new client be there,0.0
8397,watch this airport get swallow up by a sandstorm in under a minute,1.0
8399,i like a youtube video  darude  sandstorm,0.0
8400,watch this airport get swallow up by a sandstorm in under a minute,1.0
8401,watch this airport get swallow up by a sandstorm in under a minute,1.0
8402,watch this airport get swallow up by a sandstorm in under a minute,1.0
8404,watch this airport get swallow up by a sandstorm in under a minute,1.0
8405,watch this airport get swallow up by a sandstorm in under a minute,1.0
8406,a sandstorm in jordan have coat the middle eastûªs largest refugee camp in a layer of grit,1.0
8408,sandstorm woo hoo,1.0
8409,watch this airport get swallow up by a sandstorm in under a minute,1.0
8410,watch this airport get swallow up by a sandstorm in under a minute,1.0
8411,watch this airport get swallow up by a sandstorm in under a minute,1.0
8412,watch this airport get swallow up by a sandstorm in under a minute,1.0
8414,who need friends when theres booze and darude  sandstorm d,0.0
8415,socialwots globiinclusion rt nrcmiddleeast sandstorm engulf caravan and tent in the zaatari refugee camp û,1.0
8416,watch this airport get swallow up by a sandstorm in under a minute,1.0
8418,watch this airport get swallow up by a sandstorm in under a minute,1.0
8419,watch this airport get swallow up by a sandstorm in under a minute,1.0
8422,watch this airport get swallow up by a sandstorm in under a minute,1.0
8423,watch this airport get swallow up by a sandstorm in under a minute,1.0
8425,sundercr two hours of sandstorm remixes all merge together no betweensong silence,0.0
8428,watch this airport get swallow up by a sandstorm in under a minute,1.0
8429,watch this airport get swallow up by a sandstorm in under a minute,1.0
8430,put sandstorm down,0.0
8431,watch this airport get swallow up by a sandstorm in under a minute,1.0
8432,watch this airport get swallow up by a sandstorm in under a minute,1.0
8433,watch this airport get swallow up by a sandstorm in under a minute,1.0
8434,"come out to sandstorm tryouts aug 15th at lower woodland
ms tryout 3430pm
hs tryout 4306pm",1.0
8435,watch this airport get swallow up by a sandstorm in under a minute,1.0
8436,villicanaalicia be it darude sandstorm,0.0
8437,i cant listen to darude sandstorm without expect airhorns now,0.0
8440,now play darude  sandstorm  radio edit,0.0
8441,watch this airport get swallow up by a sandstorm in under a minute,1.0
8443,i slam my phone to the grind and then scream ahahahga,0.0
8444,infinitegrace7 i just scream to the world how much i love my little pony,0.0
8445,update the police seem like nice enough people i felt bad when i transform and they scream dont worry theyre only unconscious,0.0
8446,someones gonna get scream at for get the lyric wrong lmao,0.0
8447,i just scream sidjsjdjekdjskdjd  i cant stand you,0.0
8448,godofmischief of lokis daggers she pull it out and jam it into minas thigh when mina scream and grab at her leg sif,1.0
8450,"omfg
didnt expect drag me down to be the first song pandora play 

omfg i scream so loud
my coworker be scar",1.0
8451,she scream when she get the microchip needle tbh i would have cry too the needle be massive ya haram,0.0
8452,i hear the steven universe theme song from upstairs and scream his name at the part of the song and scar my cousin,0.0
8453,mogacola zamtriossu i scream after hit tweet,0.0
8454,the girls next to me scream what the fuck be a chonce im cryibg,0.0
8455,i think the loudest goal i ever scream be higuains offside goal against germany,0.0
8457,i run with earbuds in which i now realize mean i probably didnt politely say hi to jar but more or less scream at him,0.0
8458,i just get scream at for ask my dad to move half a step so i could get through,0.0
8459,cortezera i dead ass scream when we sign him i couldnt fuck believe it,0.0
8461,dont stop believe just come on the radio at this restaurant and a lil white bite scream its mommys song,0.0
8463,brooke just face time me at the concert and just scream for 2 minutes straight,0.0
8464,want to make tweet about how much i dislike todays femnism movement but doesnt want to be scream at,0.0
8468,26 people have scream right in my ear this week at camp twentysix and we still have 12 day leave cedarglade2015,0.0
8471,some kid go to leadership camp come into my work today ask for the bathroom and my inner asb kid scream a lot i miss camp,0.0
8472,vacation update my great aunt just kill a spider with her bare hand after i scream in fear fierce,1.0
8473,not because i want to cheat or anything just feel good to vent to my twitter without a txt be scream at lol,0.0
8475,im sorry im so wild in 1d show like in my wwa show niall start sing steal my girl i literally scream shut the fuck up,0.0
8476,i just scream in 57 languages this be so good,0.0
8477,i scream at the end oamsgajagahahah im laighign otrametlife,0.0
8478,i have never scream so loud,0.0
8480,i scream whats a chonce,0.0
8483,realliampayne i scream at the top of my lungs when you say you guy would come back to sa so keep your promise  addtexastonext1dtour,0.0
8484,thatwitchem emmachosenone jessienovoarp jessienovoa liananovoa why you scream,0.0
8486,arianagrande i literally walk out of the concert and scream my soul have be bless,0.0
8487,i just scream what the fuck be a hond,0.0
8489,i just scream toddyrockstar,1.0
8490,kinda scream gtlt,0.0
8491,i dont even remember slsp happen i just remember be like wtf and then the light turn off and everyone scream for the encore,0.0
8494,love wake up to my dad scream at me,0.0
8496,if you be quiet enough you can literally hear the phandom scream at the tyler tweet,0.0
8497,im scream and fangirling oh my god,0.0
8498,during drag me down last night i be scream shell of a mannequin instead of shell of a man and i think everyone hat me there,0.0
8500,camilacabello97 internally and externally scream,1.0
8502,cue the jariana stans scream,0.0
8503,bizzlemahomie scream,0.0
8504,camilacabello97 now im internally scream,0.0
8505,estellasrevenge the first time i go swim in it i be basically scream why do it smelltaste so bad,0.0
8506,scream mariahcarey arianagrande,0.0
8507,lhh silent scream be master,0.0
8508,noahshack hes hot amp he can sing im scream,0.0
8509,its fine baby i be scream at the tv x,0.0
8510,"harshness follow us a
better day
by sarah c
racing thoughts with scream sirens
pacing back and forth for",0.0
8511,my favs im scream so fuck loud,0.0
8512,tyleroakley im scream,0.0
8513,scalpium scream,0.0
8514,camilas do a follow spree tonight im scream of happiness,0.0
8515,stvmlly sorry for scream at you and safferoonicle from the car i just kinda i know those people let yell,0.0
8516,my dad a scream coach always give his vocal chord quite the workout on the field  funnydadcoach,0.0
8517,54 9 how do people not know who kendall jenner be she have 6 time the instagram followers of gd scream lmao,0.0
8518,missdaoh and if she have a scream baby you would have love that so much more,0.0
8520,arianagrande justinbieber im scream omg idols 22days wdym,0.0
8522,justinbieber arianagrande can you hear me scream,0.0
8523,kamkasteiiano bluntedjayt fuck scream,0.0
8524,arianagrande justinbieber all the love be scream at this one,0.0
8526,"hey there lonely girl
did you have to tell your friends
about the way i get you scream my name",0.0
8528,"nochilllukehammings
im scream",1.0
8530,danisnotonfire if you follow me i will go into town and advertise your youtube channel by scream and walk around with a sign pls,0.0
8531,justinbieber arianagrande scream,0.0
8533,blanksocietyx emmerdale im scream hes my favourite,0.0
8536,justinbieber arianagrande im scream,0.0
8538,scream in 22 different languages,0.0
8539,justinbieber   i be scream hell yes ahhhh omg,0.0
8540,like little boy you better sit your ass down stop scream at my mother stop pull your hair amp cry like a 3 year old amp grow tf up,0.0
8541,arianagrande justinbieber omgggg im scream,0.0
8542,trombonetristan ooooohshit ooohshit scream hell i love,0.0
8543,danemillar1 scream 666,0.0
8545,scream in the distance,1.0
8546,when you on the phone and worstoverdose scream jaileens cake up on the phone so everyone look at you,0.0
8547,scream in 25 different languages,0.0
8550,scream internally,0.0
8551,scream,0.0
8553,himeruisu im go to ram your ass so hard ill have to shove your face on the pillow to muffle your scream of pain and pleasure,0.0
8555,i come downstairs try to look as normal as possible in front of my mom and rhiannon scream hungover huh uhmmmm no,0.0
8556,he hit a tailor fuck make double play and kay scream he be rob of a hit,0.0
8557,"apparently my face scream 
get me emotionally attach and then cheat on me",0.0
8558,drag0nking0201 screamsdont scare me and its animatronics,0.0
8559,get on battlefield 3 scream into mic at cunts,0.0
8560,still echo of their scream,0.0
8561,in every bts song jimin scream,0.0
8562,casually on the phone with jasmine while she cry and scream about a spider,0.0
8567,realjaxclone scream,0.0
8570,"be the update rly life now be it be itscreams 
vibrates i cant handle",0.0
8571,"sakuuchiha yaboiluke 

screams and get a face full of saku genitals",0.0
8572,heyot6 im not home i need to watch scream,0.0
8574,in light of recent events all i would like to say be scream for five years,0.0
8575,so lawsonofficial just follow me and i cannot contain my scream of joy thankyou,0.0
8576,4tiles zacb my dell tablet scream with win10,0.0
8577,ollymursaus i do feel sorry for him he be not a piece of meat he be a nice guy people dont need to rush him and scream in his face,1.0
8578,i agree with certain cultural appropriation things but honestly if u look at my house it scream appropriation bc buddhas and stuff,1.0
8579,this looney tunesblake griffin commercial scream their make a space jam 2,0.0
8580,"scream where be everyone

oh wait school

ok

im ok",0.0
8581,aw man apollo crew just scream we cant think of a name for this black guy quick name some and mash them together,0.0
8582,queenwendy go to sleep before someone scream at us,0.0
