id,text,target
2527,on i405 southbound at coal creek pkwy there be a collision block the center lane,1.0
2528,dublin i580 e  i580 e north flynn rd onr trfc collisionno inj,1.0
2530,westminister sr22 w  knott st trfc collisionno inj,1.0
2531,anti collision rear innovation gadgets,0.0
2532,well saturn doesnt exist anymore so the collision place have a start estimate of 4000 thats 3 time what my car be worth,1.0
2534,motorcyclist bicyclist injure in denver collision on broadway,1.0
2535,west valley i405 n  us101 s i405 n con trfc collisionunkn inj,1.0
2536,missjadebrown tell of the tragic midmorning collision which claim the life of a young man rid a motorcycle,1.0
2537,twovehicle collision at fowlers corner at hwy 7 and frank hill rd be block the road opp only minor injuries to the occupants,1.0
2538,"my favorite lady come to our volunteer meeting
hopefully join her youth collision and i be excite",1.0
2539,colorado news motorcyclist bicyclist injure in denver collision on broadway at least two people be tak,1.0
2540,traffic collision  ambulance enroute elkhorn blvd at walerga rd sacramento,1.0
2541,713pm mapleridge lougheed hwy eb be close between 203rd and dewdney trunk rd because of collision eto be between 800 pm and 900 pm,1.0
2542,head on head collision ima problem and nobody can solve em on long division,0.0
2543,solano sr37  skaggs island rd trfc collision1141 enrt,1.0
2544,traffic collision  no injury i5 s at i5 s 43rd ave offramp south sac,1.0
2545,clear collision qew fort erie bind approach hwy 405 niagaravehicles remove ag,1.0
2546,motorcyclist bicyclist injure in denver collision on broadway,1.0
2547,motorcyclist bicyclist injure in denver collision on broadway  by kierannicholson,1.0
2548,south sac i5 s  i5 s 43rd ave ofr trfc collisionno inj,1.0
2550,anti collision rear gadget technology,0.0
2552,sometimes in space celestial body with separate trajectories that intertwine find themselves in a dance rather than a collision course,0.0
2553,the next financial crash ûïthe write be on the wallû donûªt say ûïyou werenûªt warnedû  via grtvnews,0.0
2554,i feel that crash and burn by thomas rhett for sure,0.0
2555,motogp indianapolis espargaro layout worry me a little,0.0
2556,just buy another meinlcymbals 18 medium crash hey meinlcymbals what about an endorsement start to get expensive,0.0
2557,html5 beginners crash course  course,1.0
2559,a slam door and a lesson learn i let another lover crash and burn,0.0
2560,sterlingknight  who have a car crashsterlingwho be drive in the carmel or joeysterling knight,0.0
2561,daewony0406 alright now im gonna crash im so exhaust,0.0
2564,party for bestival crash victim michael molloy on what would have be his 21st,1.0
2565,clear crash in hamilton on i75 south at mm 459,1.0
2566,deliver value a cash source crash course  course,1.0
2568,the next financial crash the write be on the wall dont say you werent warn,0.0
2569,be boy crash,0.0
2570,make man pikin crash,1.0
2571,"incident
crash in pascoe vale south outbound on tullamarine fwy citylink near moreland rd vehicles off in emergency lane no delay",1.0
2572,i let another love crash and burn,0.0
2573,if you sit and rant on snapchat to your apparent fan when you have about 8000 followers i hope your in a train crash xoxo,0.0
2575,crash and burn,1.0
2576,cpanel crash course  course,0.0
2579,destinythegame bungie playstation get kick out by that crash be one of the worst experience ive have play video game,0.0
2582,chelsdelong12 kendraleigh13 ill crash it,1.0
2585,please keep josh the salyersblairhall families amp jennas friends in your prayers she be take far too soon rip,0.0
2587,"one night and be gonna come and crash the party
werent invite but be feelin soû",0.0
2588,fatal crash report on johns island,1.0
2590,photoshop tool crash course  complete photoshop tool guide  course,0.0
2591,photoshop cs6 crash course  course,0.0
2592,kinetic typography crash course after effect video  course,0.0
2593,police respond to crash find suspect heroin,1.0
2594,i see dat we liable to fuck up and crash,0.0
2597,akilah world news cop pull man from car to avoid this,1.0
2598,man kill in crash in barrington hill a hoffman estates man be kill in a singlecar crash wednesday afte,1.0
2599,crash helmet silvery floor karnal fat shoot sample 33 pbcanpcx,0.0
2602,crash test trailer paul scheer amp rob huebels comedy special record on a,0.0
2603,spicybreads coxytown i try download it and it crash after the tutorial,0.0
2604,maj muzzamil pilot offr of mi17 crash near mansehra today,1.0
2605,bin lade family plane crash after avoid microlight and landi  peritoengrafoscopia,1.0
2606,my son didnt sleep all night  so finally at 4am i lay him with me on my bed and he crash out,0.0
2608,neileastwood77 i be a knobhead bin lade family plane crash after avoid microlight and land t û,1.0
2609,bin lade family plane crash after avoid microlight and land too far down runway three members of t,1.0
2611,brianroemmele ux fail of emv  people want to insert and remove quickly like a gas pump stripe reader 1 person tell me it crash the pos,1.0
2612,major hamayun shaheed pilot of mi7 heli that crash in mansehra,1.0
2614,uk bin lade family plane crash after avoid microlight and land too far down runway three members,1.0
2616,rosewell it have crash so many time the past couple hours,0.0
2617,gt bin lade family plane crash after avoid microlight and land too far down runway  rochdale heywood,1.0
2619,"my ipod crash 
weloveyoulouis 
mtvhottest one direction",1.0
2621,johndcgow hear this few days ago while drive and near crash the car from laugh to much,0.0
2622,olliebailey11 havnt you crash,0.0
2624,could anyone tell me of this here have crash or just take a very long time windows10 please,0.0
2625,intactmh370partliftsoddsplaneglidednotcrashedintosea  via yahoofinancehope for answer,1.0
2627,pak army helicopter crash in mansehra,1.0
2628,1 ûò the bug that almost crash the euro,1.0
2629,pakistan say army helicopter have crash in countrys restive northwest kill at least 8,1.0
2631,news bin lade family plane crash after avoid microlight and land too far down runway,1.0
2632,this guy buy my car on tuesday police knock my door yday cos he crash n run amp 2day he text me ask not to send the log book,1.0
2633,maj muzzamil pilot offr of mi17 crash near mansehra today may almighty give strength to family to bear the loss,1.0
2635,thief break front window of hicksville store steal 50 cell phone flee crash into,0.0
2637,army source say 12 persons on board include a team of doctor die in helicopter crash near mansehra weather seem to be cause of crash,1.0
2640,smusx16475 skype just crash u host,0.0
2641,i already have my phone update to 84 and somehow my phone crash and i have to restore it and theyre not let me restore it,0.0
2642,he be only 4 of a second faster than me and i overtake him twice then crash tru luv lt3 lt3,0.0
2643,i just nearly crash my car type paul rudd attack by fly ants into note on my phone,0.0
2644,honestly nightmarish god drive to new place be always stressful as shit amp i hate it so much ugh almost crash a few time,0.0
2645,i crash my car into a park car the other day modestmouseremix truestory,0.0
2647,"f496d mhtw4fnet

pakistan say army helicopter have crash in countrys restive northwest   fox news",1.0
2648,ttw todays news bin lade family plane crash after avoid microlight and land too far down runway,1.0
2649,hear skh on the radio for the first time almost crash the car 5sos ashton5sos luke5sos michael5sos calum5sos,1.0
2651,mh370 intact part lift odds plane glide not crash into sea,1.0
2655,kuualohax more like you love your husband but youre post another man for your man crush mondays lol,0.0
2656,womem crush wednesday  mommyisbomb,0.0
2657,jorrynja 6  your bfgfcrush  terell,1.0
2658,this guy idk just make me his woman crush  first one ever,0.0
2659,wce i cant even lie even tho i cant stand her she still will always be my crush  explicitpretty,0.0
2660,women crush,0.0
2661,my woman crush wedneday go to the beautiful taykreidler loveyouuuu aintsheperty,0.0
2663,be bestfriends with your high school crush yourboyshawn,0.0
2664,ina buted girl crush,1.0
2666,samelsamel have a crush,0.0
2667,im my own woman crush,0.0
2668,love love love do you remember your first crush,0.0
2670,have a minute alone with my crushit be an overrate experiencesmh,0.0
2671,pydisney que crushmtvhottest justin bieber,0.0
2672,master0fsloths have a crush,0.0
2673,my lil brother have a crush on mariah,0.0
2675,ron amp fez  daves high school crush  via youtube,1.0
2676,when youre girlfriend be completely gorgeous  woman crush amp stuff,0.0
2677,im so high moe im bouta crush this fridays,0.0
2679,i have the biggest crush on you amp i dont know if youll ever know it,0.0
2680,mrrobinson be give me thesteveharveyshow vibe music teacher look out for students have crush on girl he go to high school with,0.0
2682,seriously have the biggest girl crush ever on blake lively,0.0
2683,when you see your crush in the stand vine by khadidon,0.0
2684,yhngsjlg just tweet about their secret crush,0.0
2687,starflamegirl yeah i have a crush on her,0.0
2688,me try to look cute wen crush be pass by,0.0
2689,crush content marketingåêmediocrity,0.0
2691,only have a crush on one girl in high school and she dont even realize it lol,0.0
2692,sevenfigz have a crush,1.0
2693,men crush every fuck day,0.0
2694,tiffanyfrizzell have a crush,0.0
2695,more than a crush  wce nykaed,0.0
2696,jaureguiswisdom lmao well i only know one and ive only have a crush on this one sooo,0.0
2698,nowplaying fitz and the tantrums  out of my league on crush listen  nowplaying,0.0
2700,man crush everyday   cristianinspire,0.0
2701,do he love me do he love me not i aint a playa i just crush a lot,0.0
2702,kenny holland crush da vida,0.0
2703,crush,0.0
2706,this popeyes bout to get crush,0.0
2707,that be crush holy shit,0.0
2708,bhavanas mom have crush everyones soul,0.0
2709,crush it,0.0
2711,wrapup 2us cable tv company share crush after disney disappoint,0.0
2714,jimmyfallon i crush squirrel bone with a mortar and pestle for my school bio dept not really sure why worstsummerjob,0.0
2715,edwin wow crush,0.0
2719,mango juice with crush icegtgtgtgt,0.0
2720,man crush to death by own car,1.0
2723,a diamond be just a piece of charcoal that handle stress exceptionally well we be hard press on every side but not crushed2 cor48,1.0
2724,wow he crush that edwing bluejays,0.0
2725,crush the gym then crush a butterfinger flurry clearly my priorities be straight,0.0
2726,wrapup 2us cable tv company share crush after disney disappoint,0.0
2727,jmastrodonato so the question be would you crush ortiz for bunt as your sport write forefathers crush williams,0.0
2728,cbsbigbrother ouch clelliyou could almost hear their hop and dream be crush,0.0
2729,jesus christ that ball be fuck crush bluejays,0.0
2730,i crush a 31 km run with a pace of 541 with nike sportwatch gps nikeplus,0.0
2731,papi absolutely crush that ball,0.0
2732,crush a 6 mile run tonight awesome,0.0
2733,wrapup 2us cable tv company share crush after disney disappoint,0.0
2734,oil price fall but drivers could reap benefit,0.0
2736,i crush a 112 km run with a pace of 746 with nike sportwatch gps nikeplus,0.0
2739,nick williams just hit another bomb just crush it,0.0
2740,holy moly that be crush,1.0
2741,ayekoradio play brasswork agency  crush and shake  radio netlabel electronicmusic listen ccmusic,0.0
2743,so many youtube commenters say the dothraki would get crush if they come to westerosnah bro you underestimate the dothraki,1.0
2744,"disillusion lead character 
check
happy go lucky free spirit girl
check
dream life crushed
check
great music
check
all crowe tropes intact",0.0
2748,remember how nora jones crush it in two weeks notice,0.0
2749,how empire avenue crush my soul  via markwschaefer,0.0
2752,13 m chapoutier crozes hermitage so much purple violets slate crush gravel white pepper yum france wine dc,0.0
2753,thecomedyquote 50shadezofgrey the thirst have no curfew  p45perez,0.0
2755,ara news report jan fighters infiltrate ashrafiyah district of afrin with aim of carry out suicide attack ypg have impose a curfew,1.0
2756,keampurley thirst have no curfew,0.0
2757,and the fact that i have a curfew,0.0
2758,michelleellle  shut up freshman its past ur curfew u need some sleep u spend too much of ur time watch tv instead of go outside,0.0
2759,"be there a night curfew on campus

find out here",0.0
2760,police teenagers arrest for curfew violations in evanston be rid steal bicycle two teenagers take into cus  chicago news,1.0
2761,for some reason im listen to curfew overtime and stick in a kodak over and over again,0.0
2763,bobbyxfisher i shouldve give him a curfew,0.0
2765,curfew really help if you think about it  bc,0.0
2766,exofficio mens boxer brief curfew large,0.0
2767,info s wnd 0306 cld sct014 bkn032 exp inst apch rwy 05 curfew in oper until 2030 z taxiways foxtrot 5 amp foxtrot 6 navbl tmp 10,0.0
2768,emaaalay thank you  now i dont have a city wide curfew,0.0
2769,she just say do he have a curfew nope,0.0
2770,her curfew will start right after her private class end tutor must a woman preferably someone over 50,0.0
2771,aptlyengineerd there be no such curfew,0.0
2773,"it be past curfew
and we be at the grove",0.0
2774,emmychappy because its 12 oclock and my mom say everyone have to go home because of curfew,1.0
2777,reddakushgodd she say a few months but i get a curfew for out time smfh,0.0
2778,ball have no curfew,0.0
2780,scotrail i be see them turn a blind eye to a bloke drink and smoke on during the curfew time cosits not worth the hassle,1.0
2782,next may ill be freefrom school from obligations like family best of all that damn curfew,1.0
2783,daviskawalya i know mauryn143 will be say her final goodbyes to grandpa as see on news rip me always open to ideas but may ve curfew,0.0
2784,people really still be have curfew even when theyre 18 amp graduate high school,0.0
2785,stupidniggr im tell your mom your up past curfew oth,0.0
2786,have to cancel my cat doctor appointment because she decide to go out and play and not come home by curfew,0.0
2787,info r curfew in oper until 2030 z taxiways foxtrot 5 amp foxtrot 6 navbl wnd 0605 exp inst apch rwy 05 damp tmp 10 qnh 1028,0.0
2788,but no lie though its pay to be the oldest sometimes like be the first to get a car and have no curfew freedom donthate,0.0
2792,info u cld sct012 bkn025 exp inst apch rwy 05 curfew in oper until 2030 z taxiways foxtrot 5 amp foxtrot 6 navbl tmp 10 wnd 0306,0.0
2793,rite now man a tlk widout nuh curfew long side aka cum fi steal di show itz a rubbery di whole a dem fi knw sound it music,0.0
2794,dont even come if you worry about curfew bc19,0.0
2795,you get a whole curfew,0.0
2796,when youre 5 hours late for curfew and have to pray your dog doesnt bark when unlock the door,0.0
2797,da judge give dis girl 5pm curfew,0.0
2799,in the begin of summer my mom make my curfew 1 now its back to 12 and i can never go out and she wonder why im always at home,0.0
2801,why charlie lim start at 9pm on this sunday i have curfew leh,0.0
2802,when u bomb and u try 2 get home for curfew,0.0
2803,awwww baby walter rewatchingthepilot teamscorpion cyclone,0.0
2807,the big ten have their annual football media day but before we get into that heres some cyclone hoop recruit nuggets,1.0
2808,"camera art photography  0215 new boltåêcyclone dr pp400dr dual outlet power packåêfor external camera flash

30û",0.0
2811,mccauleysdesign abysmaljoiner dyamiplotke it work for my purpose a large cyclone would be better i just dont have 4k this be 500,0.0
2813,"a new tropical cyclone be form near guam

once it be form it will be call molave",1.0
2815,video new de jhaustin thomas on be a cyclone  ames tribune ames tribune video new de jhaustin thomas onû,0.0
2817,xhnews we need these plant in the pacific during the cyclone season it would help,1.0
2819,bbc force to retract false claim about cyclone pam  via wordpressdotcom,1.0
2820,great condition easton cyclone softball bat fastpitch 9 2920 sk398,1.0
2821,"severe weather bulletin no 5
for typhoon ûïhannaphû soudelor
tropical cyclone warning

issued at 500 pm 06",1.0
2822,the cyclone derive its power from a calm center so do a person  norman vincent peale,1.0
2825,roughdeal1 ante hudhud cyclone chandrababu valle ne ante ga,1.0
2826,cyclone komen devastate families in myanmar this week we need to help them today,1.0
2827,"severe weather bulletin 6
tropical cyclone warn typhoon hanna 
issued at 1100 pm thursday 06 august",1.0
2828,back to the future in vanuatu how cyclone pam have encourage traditional ways of living,1.0
2829,"bank manager ask tom in an interview what be cyclone
tom it be the loan give to purchase a bicycle",0.0
2830,excite for cyclone football,0.0
2831,bbc force to retract false claim about cyclone pam  via wordpressdotcom,1.0
2832,talent misdirection cyclone pass ignite pass vanish drive phantom shoot  kurokobot,1.0
2833,now on comdev asia radio station in bangladesh broadcast program to address the upcoming cyclone komen,1.0
2835,like a cyclone imperialism spin across the globe militarism crush people and suck their blood like a,1.0
2836,1970 mercury cyclone gt hood mould very nice core cobra jet 429cj gt,0.0
2838,im a cyclone passion overblown,0.0
2839,"his majesty emperor salman khans unstoppable cyclone of entertainment humanity
bajrangi bhaijaan create history everywhere 
crosed 300 cr",0.0
2841,1970 mercury cyclone gt quarter panel ds rear trim mould cobra jet 429cj,1.0
2842,tropical cyclone info soudelor 945hpa maximum wind speed 45ms maximum wind gust speed 60ms,1.0
2843,cyclonereizei if i may ask cyclonesama have you read jail fate by rindou,0.0
2844,some drug and alcohol in jackson vroman house,0.0
2846,blend the old with the new in vanuatu to prepare for future emergencies,0.0
2849,wfp  wfp deliver food to 165000 bangladesh flood victims after tropical cyclone komen dhaka ûòthe unite na,1.0
2851,rohingya house in kyee nockthie hamlet from taungbazar region in buthidaung be severely damage in cyclone kasitaroch vivianunhcr,1.0
2852,cyclone by double g would be the cherry on top to this outfit ootd doubleghats,0.0
2853,thelegendblue cozmo23 theyll probably allow us to ascend them but not get them to the damage max value,0.0
2854,drop it down on a nigga do damage,0.0
2855,unions say they be supportive of london yet be prepare to damage it economically å£300m last time,0.0
2856,i like a youtube video  gta 5 online  collateral damage gta v online pc,0.0
2857,fyi accident property damage3460 limestone lncolyellowstone wayfieldstone dr08052015 193635,1.0
2858,fitness knee damage solution,0.0
2860,and here i be complain about phoenix mode in fire emblem turn out ray gigant will have a difficulty option where you take 0 damage,0.0
2861,capicapricapri brentobento wha t be this kid damage,0.0
2863,clear  accident with property damage on ny35 eb at ny 100,1.0
2864,its crazy how a phone can do so much damage to a person,0.0
2865,writebothfists it get pretty windy here too but no damage,0.0
2866,reuse advance in life equipments in transit to drum champaign damage fdbdp,0.0
2867,indigo6e but if you be carful about spot damage the time of check in why not the time of give away baggage its my loss all d wy,0.0
2869,storm damage report in west tennessee,1.0
2870,hey the royals love do damage with 2 out,1.0
2871,"drothvader cmnevalistis you can keep this please arachys
    2 piece  now deal 4000 weapon damage up from 2500",1.0
2872,mages of fairy tail specialize in property damage  natsu dragneel,0.0
2873,bradleybrad47 yeah but be fast and do extremely high damage be what its all about if you want fast then im gonna have to get u the,1.0
2875,bradleybrad47 the saw be fast af and do great damage i upgrade it a shitton and use it exclusively for a whole playthrough,0.0
2877,let say a tree fall on your fence do you know how your homeowners insurance may help,0.0
2878,joedawg42 tor for a tor situation only wind damage enhance word be key imo,1.0
2879,hfxstanfield beelievedc discoverycntr what be happen we hear there be runway light damage by a contractor,1.0
2880,swb1192 if the nda be write to damage your ability to offer your service in the future then you prolly dont want the work anyway,0.0
2881,if trillion cross the line a 3rd time he do a fieldwide attack that do instant kill damage,1.0
2882,np metallica  damage inc,0.0
2883,nine inmates charge with cause damage in calgary remand centre riot,1.0
2884,pt crosssectarian protest powerful shia cleric say militias must withdrawur fightin isis but we wont forget damage uve do to ur ppl,1.0
2885,do homeowners insurance cover water damage here be some good things to know,1.0
2886,beach do damage to my shit,1.0
2887,wonderousallure cross her arm to cover her hand from do anymore damage hhello,0.0
2888,"new post on my blog  
thesensualeye

model cam damage

toronto apr 2014

nsfw pussy ass boob asian nude û",0.0
2889,report hit amp runin roadwayproperty damage at 15901 statesville rd,1.0
2890,devil may cry 4 special edition vergil vs agnus window mission 6  dmd  no damage by leedstraif,0.0
2891,glaucoma occur when fluid build up pressure inside eye to a level that may damage optic nerve eyefacts,1.0
2893,jsunnews storm damage report in madison county thunderstorm damage report ar  via,1.0
2895,s61231a puncture wind without foreign body of leave index finger without damage to nail initial encounter icd10,1.0
2896,thank you richarkkirkarch ausinstarchitect for word of warn re queenswharf brisbane  via financialreview,0.0
2898,this real shit will damage a bitch,0.0
2899,"lmao fuckboy change his  for damage control
pseudojuuzo",0.0
2900,michaelwestbiz standard damage control,1.0
2902,gettinglost jennellensbb munclejim it say they have superficial wound and it be the pepper spray that do the most damage,1.0
2905,blizzheroes dustinbrowder dad i wont chase you constantly amp all the time but frequently with a great deal of danger and distraction lt3,0.0
2907,i believe there be a shirt company now for every animal that have ever be in danger i better start see some change in wildlife,0.0
2908,danger of union bear,0.0
2909,the signup be open for the fall for danger release day blast and review tour signup here,1.0
2910,dyannbridges yeshayad check out this rockin preview of claytonbryant danger zone come soon  artistsunited,0.0
2911,red flag warn for fire danger amp dry thunderstorms in bay area  weather cawx by nwsbayarea,1.0
2912,carsonrex spaceangelseven check out this rockin preview of claytonbryant danger zone come soon  artistsunited,0.0
2913,what be this like i could be in danger or something,1.0
2915,when the last tree be cut down the last fish eat and the last stream poison you will realize that you,0.0
2916,my take away preservation park r an imposition amp a danger to african people i never imagine,0.0
2917,indian govt amp media should take serious concern about their safety they be in danger now,1.0
2920,train grain of wheat to bare gold in the august heat of their anger im the no trespass lest you seek danger,0.0
2921,therealrittz fettilootch be slanglucci oppressions greatest danger come soon the album,0.0
2922,morehouse64 it appear our govt have lose an ethical and or moral relevance this mean the whole usa population be in danger from them,0.0
2924,dont like those head first slide especially into home  danger,0.0
2925,permit for bear hunt in danger of outnumber actual bear the license for floridas fir  st petersburg,0.0
2927,riverroaming and not too much danger please,0.0
2929,bluebirddenver fettilootch be slanglucci oppressions greatest danger come soon the album,1.0
2931,uber be look to repair its recent bad rap with some nonprofit partnerships,0.0
2932,i wish i could get victorias secret on front im good for it,0.0
2933,turnedonfetaboo hsjb215 check out this rockin preview of claytonbryant danger zone come soon  artistsunited,0.0
2934,thetxi gunnersfan89 why would arsenal fan want that west ham will be in a relegation battle this season no danger for afc on sun,0.0
2935,remainontop fettilootch be slanglucci oppressions greatest danger come soon the album,0.0
2936,nuggets fettilootch be slanglucci oppressions greatest danger come soon the album,0.0
2937,the danger and excitement of underwater cave dive,0.0
2939,the girl that i wanna save be like a danger to my health try be with somebody that wanna be somebody else,0.0
2941,"gun be for protection 
that shit really shouldnt be use unless your life in danger",0.0
2942,so thirsty yall in danger of dehydration,1.0
2943,thunderstorms with little rain expect in central california high fire danger weather cawx,1.0
2944,i wanna get a danger days tattoo so bad how cool would that spider look like on someones wrist or smth,0.0
2945,in my experience if youre always angry and critical as a pundit you be in grave danger of go off the rail 1,0.0
2946,i be not in danger skyler i be the danger,0.0
2947,too dangerous for them but its ok for the rest of us to be in danger,0.0
2948,investigate why robert mueller didnt respond to my complaints since nov 2011 amp just leave meson out her in danger,0.0
2950,honestly tho modibo maiga be steal a live  fuck all about him  im past my best but still more of a danger than that fucktard coyi,1.0
2952,fear have a way of make us see danger where there be none contemplate the logic behind the situation and find the courage to engage it,0.0
2953,joel 228 and book of act 217,0.0
2954,17 dead as afghanistan aircraft crash an afghan military helicopter have crash in a remote region of the s,1.0
2955,silent0siris why not even more awesome norse landscape with load of atmosphere and life than boringdead snotgreen wastelands,0.0
2956,i miss my longer hairbut it be so dead anyways it wasnt even hair,0.0
