id,text,target
1,our deeds be the reason of this earthquake may allah forgive us all,1.0
4,forest fire near la ronge sask canada,1.0
5,all residents ask to shelter in place be be notify by officer no other evacuation or shelter in place order be expect,1.0
6,13000 people receive wildfires evacuation order in california,1.0
7,just get send this photo from ruby alaska as smoke from wildfires pour into a school,1.0
8,rockyfire update  california hwy 20 close in both directions due to lake county fire  cafire wildfires,1.0
10,flood disaster heavy rain cause flash flood of streets in manitou colorado spring areas,1.0
13,im on top of the hill and i can see a fire in the woods,1.0
14,theres an emergency evacuation happen now in the build across the street,1.0
15,im afraid that the tornado be come to our area,1.0
16,three people die from the heat wave so far,1.0
17,haha south tampa be get flood hah wait a second i live in south tampa what be i gonna do what be i gonna do fvck flood,1.0
18,rain flood florida tampabay tampa 18 or 19 days ive lose count,1.0
19,flood in bago myanmar we arrive bago,1.0
20,damage to school bus on 80 in multi car crash break,1.0
23,whats up man,0.0
24,i love fruit,0.0
25,summer be lovely,0.0
26,my car be so fast,0.0
28,what a goooooooaaaaaal,0.0
31,this be ridiculous,0.0
32,london be cool,0.0
33,love ski,0.0
34,what a wonderful day,0.0
36,looooool,0.0
37,no wayi cant eat that shit,0.0
38,be in nyc last week,0.0
39,love my girlfriend,0.0
40,cooool,0.0
41,do you like pasta,0.0
44,the end,0.0
48,bbcmtd wholesale market ablaze,1.0
49,we always try to bring the heavy metal rt,0.0
50,africanbaze break newsnigeria flag set ablaze in aba,1.0
52,cry out for more set me ablaze,0.0
53,on plus side look at the sky last night it be ablaze,0.0
54,phdsquares mufc theyve build so much hype around new acquisitions but i doubt they will set the epl ablaze this season,0.0
55,inec office in abia set ablaze,1.0
56,barbados bridgetown jamaica ûò two cars set ablaze santa cruz ûó head of the st elizabeth police superintende,1.0
57,ablaze for you lord d,0.0
59,check these out     nsfw,0.0
61,"on the outside youre ablaze and alive
but youre dead inside",0.0
62,have an awesome time visit the cfc head office the ancop site and ablaze thank to tita vida for take care of us,0.0
63,soooo pump for ablaze  southridgelife,0.0
64,i want to set chicago ablaze with my preach but not my hotel,0.0
65,i gain 3 followers in the last week you know your stats and grow with,0.0
66,how the west be burn thousands of wildfires ablaze in california alone,1.0
67,build the perfect tracklist to life leave the streets ablaze,0.0
68,check these out     nsfw,0.0
71,first night with retainers in its quite weird better get use to it i have to wear them every single night for the next year at least,0.0
73,deputies man shoot before brighton home set ablaze,1.0
74,man wife get six years jail for set ablaze niece,1.0
76,santa cruz ûó head of the st elizabeth police superintendent lanford salmon have r,0.0
77,police arsonist deliberately set black church in north carolinaåêablaze,1.0
78,noches elbestia alexissanchez happy to see my teammates and train hard  goodnight gunners,0.0
79,kurds trample on turkmen flag later set it ablaze while others vandalize offices of turkmen front in diyala,1.0
80,truck ablaze  r21 voortrekker ave outside or tambo intl cargo section,1.0
81,set our hearts ablaze and every city be a gift and every skyline be like a kiss upon the lips û,0.0
82,they sky be ablaze tonight in los angeles im expect ig and fb to be fill with sunset shots if i know my peep,0.0
83,how the west be burn thousands of wildfires ablaze in california alone  climate energy,1.0
85,revel in yours wmv videos by mean of mac farewell ablaze wmv en route to dvd gtxrwm,0.0
86,"progressive greetings

in about a month students would have set their pen ablaze in the torch publications",0.0
89,rene ablaze amp jacinta  secret 2k13 fall sky edit  mar 30 2013,0.0
91,navista7 steve these fire out here be something else california be a tinderbox  and this clown be set my hood ablaze news24680,1.0
92,nowplaying rene ablaze amp ian buff  magnitude   edm,0.0
93,nxwestmidlands huge fire at wholesale market ablaze,1.0
95,ablaze what time do your talk go until i dont know if i can make it due to work,0.0
96,i cant have kid cuz i get in a bicycle accident amp split my testicles its impossible for me to have kid michael you be the father,0.0
97,accident on i24 w nashvilletraffic traffic move 8m slower than usual,1.0
98,accident center lane block in santaclara on us101 nb before great america pkwy bayarea traffic,1.0
100,have a personalinjury accident this summer read our advice amp see how a solicitor can help otleyhour,0.0
102,stlouis caraccidentlawyer speed among top cause of teen accidents   car accident teeû,0.0
104,report motor vehicle accident in curry on herman rd near stephenson involve an overturn vehicle please use,1.0
105,bigrigradio live accident awareness,1.0
107,i77 mile marker 31 south mooresville  iredell vehicle accident ramp close at 86 118 pm,1.0
109,rt sleepjunkies sleep pills double your risk of a car accident,0.0
110,by accident they know what be gon happen,0.0
112,traffic accident n cabrillo hwymagellan av mir 080615 110358,1.0
113,i77 mile marker 31 to 40 south mooresville  iredell vehicle accident congestion at 86 118 pm,1.0
114,the pastor be not in the scene of the accidentwho be the owner of the range rover,1.0
117,"mom we didnt get home as fast as we wish 
me why be that
mom there be an accident and some truck spill mayonnaise all over",0.0
118,i be in a horrible car accident this past sunday im finally able to get around thank you god,1.0
119,can wait to see how piss donnie be when i tell him i be in another accident,0.0
120,truckcrash overturn on fortworth interstate  click here if youve be in a crashgt,1.0
121,accident in ashville on us 23 sb before sr 752 traffic,1.0
126,carolina accident motorcyclist die in i540 crash with car that cross median a motorcycle rider travel,1.0
128,fyi cadfyi accident property damagenhs999 piner rdhorndale dr,1.0
129,rt naayf first accident in years turn onto chandanee magu from near mma taxi ram into me while i be halfway turn everyone confû,1.0
130,accident leave lane block in manchester on rt 293 nb before eddy rd stop and go traffic back to nh3a delay of 4 mins traffic,1.0
131,accident property damage piner rdhorndale dr,1.0
132,it be an accident,0.0
133,fyi cadfyi accident property damagewpd1600 s 17th st,1.0
134,862015209 pm traffic accident no injury at 2781 willis foreman rd,1.0
135,aashiqui actress anu aggarwal on her nearfatal accident,1.0
136,suffield alberta accident,1.0
137,9 mile backup on i77 southaccident block the right 2 lanes at exit 31 langtree rdconsider nc 115 or nc 150 to nc 16 as alternate,1.0
138,have an accident change your life we will help you determine options that can financially support life care plan and ongoing treatment,0.0
139,break there be a deadly motorcycle car accident that happen to hagerstown today ill have more detail at 5 your4state whag,1.0
141,flowri be you marinade it or be it an accident,0.0
143,only have a car for not even a week and get in a fuck car accident  mfs cant fuck drive,1.0
144,norwaymfa bahrain police have previously die in a road accident they be not kill by explosion,1.0
145,i still have not hear church leaders of kenya come forward to comment on the accident issue and disciplinary measuresarrestpastornganga,0.0
146,aftershockdelo scuf ps live and the game cya,0.0
149,"the man who can drive himself further once the effort get painful be the man who will win 
roger bannister",0.0
151,320 ir icemoon aftershock    djicemoon  dubstep trapmusic dnb edm dance icesû,0.0
153,there be no victory at bargain basement price dwight david eisenhower,0.0
156,320 ir icemoon aftershock    djicemoon  dubstep trapmusic dnb edm dance icesû,0.0
157,nobody remember who come in second charles schulz,0.0
158,aftershockdelo im speak from someone that be use a scuf on xb1 most of them people will end up get on for ps also,0.0
159,the harder the conflict the more glorious the triumph thomas paine,0.0
160,growingupspoiled go clay pigeon shoot and cry because of the aftershock,0.0
161,so i guess no one actually want any free aftershock tc,0.0
162,aftershock be the most terrify best roller coaster ive ever be on disclaimer ive be on very few,0.0
163,aftershock,0.0
164,320 ir icemoon aftershock    djicemoon  dubstep trapmusic dnb edm dance icesû,0.0
165,320 ir icemoon aftershock    djicemoon  dubstep trapmusic dnb edm dance icesû,0.0
168,320 ir icemoon aftershock    djicemoon  dubstep trapmusic dnb edm dance icesû,0.0
170,kjfordays im see them and issue at aftershock,0.0
171,320 ir icemoon aftershock    djicemoon  dubstep trapmusic dnb edm dance icesû,0.0
172,320 ir icemoon aftershock    djicemoon  dubstep trapmusic dnb edm dance icesû,0.0
173,wisdomwed bonus  5 minute daily habit that could really improve your life how many do you already do lifehack,0.0
174,aftershock protect yourself and profit in the next global financial meltdown by david wiedemer http,0.0
175,that moment when you get on a scary roller coaster and the guy behind you be just scream bloody murder  silverwood aftershock,0.0
176,aftershock ã¢ 2010 fullã¢ stream  youtube,0.0
178,"gtgt 15 aftershock  protect yourself and profit in the next global financial book 
esquireattire",0.0
180,sometimes you face difficulties not because youre do something wrong but because youre do something right  joel osteen,0.0
182,the only thing that stand between you and your dream be the will to try and the belief that it be actually possible  joel brown,0.0
183,praise god that we have ministry that tell it like it be now wdyouth biblestudy,0.0
184,remember that you be go to die be the best way i know to avoid the trap of think you have something to lose ûò steve job,0.0
185,try orange aftershock today my life will never be the same,0.0
187,onfireanders i love you bb,0.0
190,aftershock,0.0
191,aftershock back to school kick off be great i want to thank everyone for make it possible what a great night,0.0
193,people who say it cannot be do should not interrupt those who be do it ûò george bernard shaw,0.0
194,the first man get the oyster the second man get the shell andrew carnegie,0.0
195,anyone need a pu tonight i play hybrid slayer ps4 eu hmu cod8sandscrims empirikgaming codawscrims 4tpkotc 4tpfa aftershockorg,0.0
196,experts in france begin examine airplane debris find on reunion island french air accident experts o  news,1.0
197,strict liability in the context of an airplane accident pilot error be a common component of most aviation cr,1.0
198,crobscarla your lifetime odds of die from an airplane accident be 1 in 8015,0.0
199,experts in france begin examine airplane debris find on reunion island french air accident experts on wedn,1.0
201,alexalltimelow awwww theyre on an airplane accident and theyre gonna die what a cuties  good job,1.0
203,family members of osama bin lade have die in an airplane accident how ironic  mhmmm gov shit i suspect,1.0
204,man go into airplane engine accident  via youtube,1.0
205,horrible accident  man die in wing of airplane 29072015,1.0
208,a cessna airplane accident in ocampo coahuila mexico on july 29 2015 kill four men include a state of coahuila government official,1.0
209,horrible accident man die in wing airplane 29072015 watchthevideo,1.0
210,experts in france begin examine airplane debris find on reunion island  french air accident experts on wednesdayû,1.0
211,experts in france begin examine airplane debris find on reunion island french air accident experts on wednesday begin examine t,1.0
212,kca votejkt48id mbataweel rip binladen family members who kill in an airplanes accident,1.0
213,i almost send my coworker nudes on accident thank god for airplane mode,0.0
215,mickinyman theatlantic that or they might be kill in an airplane accident in the night a car wreck politics at its best,0.0
216,experts in france begin examine airplane debris find on reunion island french air accident experts on  mlb,1.0
218,"this be unbelievably insane
man airport airplane aircraft aeroplane runway accident freakyû",1.0
219,horrible accident   man die in wing of airplaneåê29072015,1.0
220,horrible accident man die in wing of airplane 29072015,1.0
221,usama bin ladins family dead in airplane crash naturally no accident,1.0
222,pilot die in plane crash at car festival  via youtube crash aircraft airplane pilot death accident carfest,1.0
225,strict liability in the context of an airplane accident,1.0
226,dtn brazil experts in france begin examine airplane debris find on reunion island french air accident exp,1.0
229,experts in france begin examine airplane debris find on reunion island french air accident experts on wedn,1.0
231,horrible accident man die in wing of ûïairplaneû 29072015 wtf you canûªt believe your eye ûò,1.0
232,"nicole fletcher one of a victim of crash airplane few time ago 

the accident leave a little bite trauma for her although shes",1.0
235,omg horrible accident man die in wing of airplane,1.0
237,"omg i dont believe this rip bro
airplane accident jetengine turbojet boing g90",1.0
238,experts in france begin examine airplane debris find on reunion island french air accident experts on wednesday begin examine t,1.0
240,i have a airplane accident,1.0
241,my phone look like it be in a car ship airplane accident terrible,0.0
242,statistically im at more of risk of get kill by a cop than i be of die in an airplane accident,0.0
243,airplane crash on house in colombia 12 people die in accident,1.0
244,the shoot or the airplane accident,1.0
245,could a drone cause an airplane accident pilot worry about use of drone esp in close vicinity of airports,1.0
246,early wake up call from my sister beg me to come over amp ride wher in the ambulance to the hospital rodkiai,1.0
247,twelve fear kill in pakistani air ambulance helicopter crash,1.0
248,two air ambulances on scene of serious crash between two cars and lorry in      emsneû,1.0
249,twelve fear kill in pakistani air ambulance helicopter crash  reuters  yugvani,1.0
251,lead emergency service boss welcome new ambulance charity,0.0
252,anyone travel aberystwythshrewsbury right now theres be an incident service at a halt just outside shrews ambulance on scene,1.0
253,twelve fear kill in pakistani air ambulance helicopter crash,1.0
254,ambulance sprinter automatic frontline vehicle choice of 14 lez compliant  ebay,0.0
256,new nanotech device will be able to target and destroy blood clot,0.0
258,20skyhawkmm20 traplord29 fredosantana300 lilreese300 it be hella crazy 3 fight an ambulance and a couple mosh pit,1.0
260,if i get run over by an ambulance be i lucky justsaying randomthought,0.0
261,news twelve fear kill in pakistani air ambulance helicopter crash  tilnow dna,1.0
262,twelve fear kill in pakistani air ambulance helicopter crash,1.0
263,tanslash wait for an ambulance,0.0
264,fouseytube you ok need a ambulance hahahah that be good,0.0
265,ambulance sprinter automatic frontline vehicle choice of 14 lez compliant  ebay,0.0
266,pakistan air ambulance helicopter crash kill nine,1.0
267,thenissonian rejectdcartoons nissan be you ok do you need medical assistance i can call an ambulance if you need me to,0.0
268,ems1 ny emts petition for 17 per hour û÷minimum wageûª  ems paramedics ambulance,0.0
269,twelve fear kill in pakistani air ambulance helicopter crash,1.0
270,twelve fear kill in pakistani air ambulance helicopter crash,1.0
271,ambulance sprinter automatic frontline vehicle choice of 14 lez compliant  ebay,0.0
272,ambulance sprinter automatic frontline vehicle choice of 14 lez compliant  ebay,0.0
273,kiwikaryn check out whats in my park lot he say that until last year it be an ambulance in st johns,0.0
274,when you dont know which way an ambulance be come from ltlt,1.0
276,reuters twelve fear kill in pakistani air ambulance helicopter crash,1.0
277,twelve fear kill in pakistani air ambulance helicopter crash,1.0
279,why be there an ambulance right outside my work,0.0
280,ûïleoblakecarter this dog think hes an ambulance,0.0
281,happen now  hatzolah ems ambulance respond with dual sirens andû,0.0
283,twelve fear kill in pakistani air ambulance helicopter crash,1.0
285,twelve fear kill in pakistani air ambulance helicopter crash,1.0
287,twelve fear kill in pakistani air ambulance helicopter crash  worldnews,1.0
289,twelve fear kill in pakistani air ambulance helicopter crash  worldnews,1.0
290,whats the police or ambulance number in lesotho any body know,0.0
291,medic914 aaceorg i be surprise we still cannot standardise the clinical practice across the 11 nhs ambulance trust,0.0
293,twelve fear kill in pakistani air ambulance helicopter crash,1.0
294,people who try to jwalk while an ambulance be pass i hate you,0.0
296,the episode where trunks annihilate freiza be the cleanest shit ever he show that nigga no mercy,0.0
297,they shall be annihilate and all of their petebests dessicated and lay bare then you shall kneel before me,0.0
298,uribe just annihilate that baseball mets,0.0
299,marksmaponyane heysundowns be annihilate in their previous meet with celticindeed its an improvement,0.0
301,volfan326 tneazzy mizzou have annihilate florida the past 2 season even end muschamps career just cant compete with bama,0.0
302,annihilate abs,1.0
303,be annihilate for status education mba on behalf of a on easy street careen eovm,0.0
307,to luka they should all die all of them everything annihilate  alois trancy,0.0
309,acarewornheart have a good un fella sorry i wont be there to get annihilate with you,0.0
310,cop pull drink driver to safety second before his car be hit by train   via viralspell,1.0
312,you must be annihilate,0.0
313,cop pull drink driver to safety second before his car be hit by train   via viralspell,1.0
314,boom your country be just entirely annihilate by a hû ûó britain,0.0
315,amirkingkhan you would have be annihilate so you might as well thank floydmayweather,0.0
316,one thing for suregod have promise israel will not be annihilate butthe horror of iran wnukes,0.0
318,violentfeminazi i guess thats ok for armenians since weve spend most of our history get annihilate,1.0
320,70 years since we annihilate 100000 people instantly and become aware that we have the ability to annihilate the whole of humanity,1.0
321,day 1 of tryouts go good minus the fact i stop quickly to get a short ball and annihilate my toenail injury even more,0.0
322,during the 1960s the oryx a symbol of the arabian peninsula be annihilate by hunters,1.0
327,to luka they should all die all of them everything annihilate  alois trancy,0.0
328,ready to get annihilate for the bucs game,1.0
329,philipduncan breakfastone people annihilate by last nights weather really philip think you would have forecast that,1.0
330,domain other sophistication be annihilate closely uptotheminute feat zrnf,0.0
331,stormbeard steellord i see judas priest in 2005 when rob come back scorpions as support fuck annihilate the place astonish gig,0.0
332,officially skip out on fantasticfourfant4sticwhatever the hashtag be its get annihilate in review bummer,0.0
334,tomcatarts thus explain why you be all annihilate but the few or in this case you the only survivor evolve and become godlike,1.0
335,just completely annihilate cech with paul keegan what a time to be alive,0.0
336,tomcatarts who then be annihilate by the legion itself the survivors of the imperfect hybrid project quickly form a new secret cell,0.0
337,sirbrandonknt exactly thats why the lesnarcena match from summerslam last year be so great because brock annihilate a guy whos,0.0
338,cop pull drink driver to safety second before his car be hit by train   via viralspell,1.0
340,annihilate in damascus syrian army grind û÷alloosh and his gang into the manure pile,1.0
341,thatdes ok i wasnt completely forthright i may have also be in a food coma bc of the kebabtahinipickles i also annihilate wfries,0.0
344,a fun fill happyhour at simmons bar in camden with this handsome one  i get annihilate apart from this game,0.0
345,juanny beisbol sr annihilate that ball lgm,0.0
346,rvfriedmann hell be just a fraction of his belief of total annihilation destruction of usa lodisilverado ritzyjewels,1.0
347,potus maybe we should call israel and tell them be sorry be pres have sell them down the river to annihilation,0.0
348,evildead  annihilation of civilization,0.0
349,us national park service tonto national forest stop the annihilation of the salt river wild horse  via change,0.0
352,annihilate quarterstaff of annihilation,1.0
353,world annihilation vs self transformation  alien attack to exterminate humans,0.0
354,starmade stardate 3 planetary annihilation  via youtube,1.0
355,us national park service tonto national forest stop the annihilation of the salt river wild horse  via change,0.0
356,us national park service tonto national forest stop the annihilation of the salt river wild horse  via change,1.0
358,kimkardashian can you please sign and share this petition to save wild horse in arizona,0.0
360,us national park service tonto national forest stop the annihilation of the salt river wild horse  via change,1.0
361,theellenshow please check into salt river horse help stop the annihilation about to happen without 54000 more signatureschange org thx,0.0
363,be souls punish withåêannihilation,0.0
364,calfreedommom steph93065 not to mention a major contributor to the annihilation of israel,1.0
365,willienelson we need help horse will dieplease rt amp sign petitiontake a stand amp be a voice for them gilbert23,1.0
368,i reject the laws of the misguide false prophets imprison nations fuel self annihilation,0.0
370,us national park service tonto national forest stop the annihilation of the salt river wild horse  via change,0.0
371,"the annihilation of jeb christie amp kasich be less than 24 hours away
please god allow me at least one more full day",0.0
372,barbitwins we need helphorses will die please rt amp sign petition take a stand amp be a voice for them gilbert23,0.0
375,whippenz we need help horse will dieplease rt amp sign petitiontake a stand amp be a voice for them gilbert23,0.0
380,hey az sign this petition to save the wildhorses  tantonationalforest a rollingstones singalong be in order,0.0
381,stop the annihilation of the salt river wild horse  via change,1.0
383,sonofbaldwin and hes the current nova in the bookslast i checkedhe be tie into the book in 2011 after rider die during annihilation,0.0
384,us national park service tonto national forest stop the annihilation of the salt river wild horse  via change,0.0
386,please sign amp rt to save saltriverwildhorses,0.0
389,thank count dante    do join us by follow the annihilation zone  johnny,0.0
390,world annihilation vs self transformation  alien attack to exterminate humans,1.0
393,us national park service tonto national forest stop the annihilation of the salt river wild horse  via change,0.0
394,us national park service tonto national forest stop the annihilation of the salt river wild horse  via change,1.0
396,im gonna fight taylor as soon as i get there,0.0
397,ohh no fukurodani didnt survive the apocalypse bokuto feel horrible  my poor boy my ppor child,1.0
398,will there be another jocelyn birthday apocalypse,0.0
401,rt janenelson097 rt stephenscifi adaptation watch charlie humans apocalypse now now optioned for film sciencefiction û,0.0
402,apocalypse please,0.0
404,another hour its august 05 2015 at 0802pm heres red rover zombie apocalypse 2014  internetradio collegeradiû,1.0
406,honeybunzgem primalkitchen i feel like me do a pullup be one of the stag of the apocalypse,0.0
407,shes kinda hot play on the radio today whats next disease to all the apocalypse have start everyone be careful,0.0
409,but if its the apocalypse lol gf m8,0.0
410,i know its a question of interpretation but this be a sign of the apocalypse  i call it,1.0
412,julie  r be the apocalypse version of romeo  juliet warmbodies,0.0
413,the apocalypse be upon us,0.0
415,rt fittscott minecraft night lucky block mod bob apocalypse wither 20 amp more mod showcase popularmmos  viû,0.0
418,and so it begin day one of the snow apocalypse,1.0
419,"rt ourmothermary short reading

apocalypse 211023 

in the spirit the angel take me to the top of an enormous high mountain and û",0.0
420,candylit imagine sarumi in a zombie apocalypse fight back to back heart to heart conversations over the,0.0
421,rt zonewolf123 i like a youtube video  minecraft night lucky block mod bob apocalypse wither 20 amp more moû,0.0
423,and thats because on my planet its the lone audience of the apocalypse,0.0
424,dad buy a dvd that look like a science doc on the front but i read the back and its actually about the impend biblical apocalypse,1.0
426,alexandrapullin it be indeed if the apocalypse come this week i know where ill be,0.0
427,go look at grizzly peak right now it look like the begin of an dystopian apocalypse movie,0.0
429,my niece just ask me would you be scar if there be an apocalypse here,0.0
432,theres a storm over cairo in the latest xmen apocalypse set photo  via yahootv,1.0
435,minecraft night lucky block mod bob apocalypse wither 20 amp more mod showcase popularmmos  via youtube,0.0
436,shoot through the heart xv you be go to totally give love a bad name with this heart pierc,0.0
437,rt geekapocalypse 4pm gmt hesse play dark souls 2 day 9   etcpb,0.0
438,i know where to go when the zombies take over,0.0
440,the latest from bryansinger reveal storm be a queen in apocalypse rupaul alexshipppp,1.0
442,shadow box the apocalypse,1.0
443,"short reading

apocalypse 211023 

in the spirit the angel take me to the top of an enormous high mountain and",1.0
