id,text,target
5304,the fear of the lord be the start of knowledge but the foolish have no use for wisdom and teach amsal 17,0.0
5305,the number of people deny climate change on the polar bear article make me fear for the future of the us but also humanity in general,0.0
5306,"sensanders gd ideas im 77 wrked hard now have almost nothing fear live with poor
fran reed 8437150124",0.0
5308,never let fear get in the way of achieve your dream deltachildren instaquote quoteoftheday disney waltdisney,0.0
5309,fear be my motivator,0.0
5310,"daily reflections
august 6
driven
driven by a hundred form of fear selfdelusion selfseeking and selfpity",0.0
5313,morganite gemstone white fire opal 925 sterling silver ring size 6 r1354,0.0
5315,marquei como visto game of throne  3x5  kiss by fire  bancodeseries,0.0
5316,save the date saturday august 15 2015 be the salisbury fire department open house at 325 cypress st 10am to,0.0
5317,why put out a fire when its still burn,0.0
5319,misshomasttopa cause be on fire we be on fire be on fire now yeah be on fire we be on fire be on fire nowwwwww,1.0
5320,my avi and header combo be fire,0.0
5321,auction shoe retro 5 fire red,0.0
5322,my asshole be on fire,0.0
5323,im cry that song just end set myself on fire,0.0
5324,set things on fire be always an option,1.0
5325,sit around a fire sound great right about now,0.0
5326,i see fire,0.0
5328,but put flood of fire at the top of the list,1.0
5330,im on fire,0.0
5331,politifiact harry reids 30 percent of women serve plan parenthood claim be a pant on fire lie   tcot,0.0
5332,dear canonusaimaging i bring it  canonbringit fire  canontattoo mn theresmorewherethatcamefrom,0.0
5335,seanhannity scottwalker yeah just who we need another middle class hat republican out to get hard work cop fire fighters teachers,0.0
5336,this fire be way too close wtf be go on,1.0
5337,fire meet gasoline always gotta get play twice lol,0.0
5338,wcw catsandsyrup tha bitch be fire,0.0
5339,well it feel like im on fire,0.0
5341,her eye and word be so icy but she burn like rum on the fire,0.0
5342,news politifiact harry reids 30 percent of women serve plan parenthood claim be a pant on fire lie,0.0
5343,nothing like a good fire,1.0
5344,daughterofnai tenshi activate yukis fire card,0.0
5345,california be shakingcatching on fireand overcharge ppl on rent for the past 150 years it aint go nowhere,1.0
5346,theres a fire in the catalinas look kinda cool this picture doesnt do it justice,1.0
5347,zaynmalik dont overwork yourself your album be gonna be fire just dont overwork or stress i love you take care,0.0
5349,justinling i promise not to tax pancakes or rainbows or not die in a fire,0.0
5350,this nigga cyhi diss be what meek be suppose to do this shit actually fire,0.0
5351,i wanna set some shit on fire,1.0
5352,in the word of charlie daniels fire on the mountain run boys runû,1.0
5353,i just check in ûò at on fire on zomatoaus lovefood,1.0
5354,when your heart be bigger than the obstacles  in front of you euro dontexpectnothing july fire euro,0.0
5355,fire wave and darkness,0.0
5356,it may seem like our fire have be a little burn out,0.0
5357,smell a bon fire while drive make me wanna be sit near one make smores,1.0
5359,will be drop fire selfie tomorrow say youre welcome ahead of time,0.0
5362,fire call brant av  drummond rd for fire  structure  single units car 6 on call truck,1.0
5365,your psa for the day if a fire truck be behind you with light go move over so they can get to their call,0.0
5366,rfp fire truck service body for f450 fire fight rescue amp safety equipment transporta,0.0
5367,reno truck trailer catch fire in reno,1.0
5368,wild night in the village of pugwash every fire truck be out that the town have which be like a fire truck for every house population6,1.0
5371,an 18wheeler come along and strike the fire truck spin it around 180 degrees and cause it to roll over,1.0
5372,sigalert update 3n133 close at 5 fwy ufn trash truck fire,1.0
5373,brooktekle didnt look like a murder scene just 1 cop a fire truck and 2 fire assistance cars along with a helicopter,1.0
5375,former township fire truck be use in philippines  langley time  philippines,1.0
5377,former township fire truck be use in philippines township of langley assistant fire chief pat walker spen,1.0
5378,our garbage truck really catch on fire lmfao,0.0
5379,kapokekito on northgate by the taco truck thats fire,1.0
5380,its never a good sign when you pull up to work amp theres five ambulances amp a fire truck in the bay wompppp at least its friday,1.0
5381,fire truck and ambulance in k3 phase 3 hope everyones okay prayforsaipan,1.0
5382,sigalert north amp southbound 133 close btwn 5 fwy and irvine blvd due to truck fire chp be detour traffic,1.0
5383,eeenice221 true because of the truck that catch fire,1.0
5384,justinejayyy ohgod xd i didnt mean it so p but you have that fire truck in the back of you to make up for it so you good xd,0.0
5385,"come across this fire video not mineenjoybabes way of say hi to me while hes in the fire truck
fireman û",0.0
5386,133 n past  the 5 l lane be reopen all other lanes be close all lanes be open on the 133 s trash truck fire cleanup knx1070,1.0
5387,sigalert north amp southbound 133 close btwn 5 fwy and irvine blvd due to truck fire chp be detour traffic,1.0
5389,find this cool photo not mine 1952 dodge wayne body 4 window bus  ex libby mt fire department truck all oriû,1.0
5391,trident 90225 chevy fire truck w pumper  ims fire dept red ho 187  plastic,0.0
5392,toddler bed firetruck bundle fire truck firefighter sticker decals sign wall,0.0
5396,when a monster truck racer catch on fire at the fair,1.0
5397,truck fire clog canyon road,1.0
5400,rgj truck trailer catch fire in reno,1.0
5403,philippines former township fire truck be use in philippines û  of emergency equipment in cebu philippi,1.0
5404,theres a fire truck in this park lot,0.0
5406,even sun article on nno,0.0
5407,choose to be happy fire truck the rest   review of kick push by jaymcleanauthor,0.0
5408,former township fire truck be use in philippines  langley time  filipino,0.0
5409,jacksonville fire amp rescue engine 58  awesome truck  official jade fl  via youtube,1.0
5410,njturnpike å njturnpike reopen hours after truck fire in,1.0
5411,lukebox something about first responders military they be our true heros besides your music,0.0
5412,im grateful for our first responders  mnpdnashville nashvillefd and others  who act so swiftly to save countless live today,1.0
5413,usatoday  pray for gods heal and safety of first responders,0.0
5416,"join charity 10k run event doningtondash
11am start sun 20 sept 2015
castle donington community first responders",0.0
5417,love the way this book be write to include so many vantage point of first responders detkenlang kindle,0.0
5418,first responders would never be send to the wrong address again w smartteks gpsbased panic button mpers safety,0.0
5420,û÷we can helpûª say denver firefighter work to curb first responder suicide,1.0
5423,whats cool be that teens be become what i like to call digital first responders for their friends who need a little help or support,0.0
5425,carmike cinemas on antioch shoot we be grateful for staff and first responders safety be highest priority,1.0
5426,rt roadid thank to alex for his story amp to all first responders for be there when we need you û,0.0
5428,i just add sandy first responders lose their home to vip home page group on vimeo,1.0
5430,thankful for our first responders especially mnpdnashville for life save response today in antioch,1.0
5432,juneau empire  first responders turn out for national night out,0.0
5437,reds i dont throw the word hero around lightly usually reserve for first responders and military but hes a hero,0.0
5439,us want future first responders to be more hightech,0.0
5442,theres still room for you at our party for first responders from around the country 3rd annual best ever,0.0
5443,incase of accident the first responders would know that there be a baby present,0.0
5444,kirsten gillibrand     extend health care to 911 first responders,1.0
5445,we can help say denver firefighter work to curb first responder suicide,1.0
5446,first responders convene for national summit and award on gi technology  gisuserpr geotech,0.0
5448,york co first responders compete to save live in û÷badges for bloodûª paramedic ems,0.0
5449,some good info to help first responders cope individual resilience factsheet for responders,0.0
5450,iafflocal4416 no live lose except those of first responders or the public theyre charge with protect,1.0
5452,first responders get int bridgeportspeed free on saturday detail,0.0
5454,at the 999day emergency service display meet the brave police firefighters and first responders that help keep us safe,1.0
5455,this week first responders and dart members be participate in a four day intensive technical large animal,1.0
5458,as firefighters make gain on rockyfire jerry brown be head to the area to meet with first responders tomorrow morning,1.0
5459,after shoot event at the theater starbucks be give free coffee to all first responders police amp firefighters antiochhickoryhollowtn,1.0
5460,no lender fee for veterans or first responders past and present on linkedin,0.0
5461,new giant flame giant full black pantofel infoorder sms087809233445 pin23928835   pictwittercompnpizody,1.0
5462,new snap on tool black baseball hatcap silvergray embroider s logo flame  full reû,0.0
5465,new snap on tool black baseball hatcap silvergray embroider s logo flame  full reû,0.0
5466,vampiro go through the table of flame ultimalucha luchaunderground elreynetwork,0.0
5467,cabin fever 2 flame,0.0
5468,"if you cant summon the flame directly from hell store buy be fineme 
momdies",0.0
5469,just add some more fire to the flame for saturday rick wonder will be spin a guest set along with chachi,0.0
5471,kelworldpeace taxstone yoga flame,0.0
5473,sbnation flame what make a good penalty killer,0.0
5475,i guess you can say igs hop go up in flame,0.0
5476,ill cry until my pity party in flame,0.0
5477,that new lil b x chance be nothing but flame,0.0
5479,gilderoy i wish i be good enough to add flame to my nail im on fire,1.0
5480,my gang walk round with them brown flame  amp thats 100nd,0.0
5481,new snap on tool black baseball hatcap silvergray embroider s logo flame  full reû,0.0
5482,tadhgtgmtel dude be just smoke and the fuck thing go up in flame i though a bomb go off omg scar,1.0
5484,maryland mansion fire that kill 6 cause by damage plug under christmas tree report say  into the flame,1.0
5485,new giant flame giant manly brown infoorder sms087809233445 pin2327564d,0.0
5486,ûïyou see the devastation amp itûªs shockingûï  firefighters continue to battle flame in california benstracy report û,1.0
5487,watch it go up in flame,1.0
5488,rp say they can see smoke come from the silo on 260th street in hartford but no flame,1.0
5489,i choose you so if we can search for the joy of just the two of us weûªll be near smile no matter what cold flame burn our bod portgassdk,0.0
5491,maryland mansion fire that kill 6 cause by damage plug under christmas tree report say  into the flame firefighters bravery,1.0
5492,erinmariefishy everyone be set flame upon me,0.0
5493,flamesnation thats the optimistic side of me no doubt its tough but it can be do i feel like the game will pivot on defense,0.0
5494,maryland mansion fire that kill 6 cause by damage plug under christmas tree report say  into the flame,1.0
5495,"so pardon me while i burst into flame 

ive have enough of the world and its people mindless game",0.0
5496,awickedassassin want to burst into flame anna hug him tightly,0.0
5497,selmoooooo edvinnn imtariik dzaficharis selmo u not catch flame from me  im just gonna be witness the slaughter,1.0
5498,bloody ell let it burn rubybot,0.0
5499,if you have an opinion and you dont put it on thh internet you will furst into flame,0.0
5501,i have a rise follower graph 2 more followers in the past week get your stats right here,0.0
5502,aisumage akumareisu just between gray and ophelia red flame blaze around her person set nearly everything in the area,1.0
5503,soloquiero maryland mansion fire that kill 6 cause by damage plug under christmas tree report say  into the flame firefighte,1.0
5505,maryland mansion fire that kill 6 cause by damage plug under christmas tree report say  into the flame,1.0
5506,cwhoops you better make all your shots tomorrow cause im record and flame will be throw tomorrow,0.0
5507,i add a video to a youtube playlist  nicki minaj  up in flame official video,0.0
5509,he better than sean bro i can admit that sean be flame now but he better than sean,0.0
5510,the advantage apropos of in flame favorable regard mississauga ontario pwhvgwax,0.0
5514,"flatten all cartoonylike
whoa there papa",0.0
5515,the road to success be pave with pennies that i flatten on the train track youre welcome,0.0
5517,feel like ive be flatten by a sumo wrestler  no pain no gain muaytai wantmyabsback strong,0.0
5518,ideas in food flatten,0.0
5519,zouma have just flatten him there  cfc,0.0
5520,zouma have just absolutely flatten that guy,0.0
5521,flatten,0.0
5522,70 years ago the first atomic attack flatten hiroshima 3 days later it be nagasaki both war crimes to put moscow in its place,1.0
5524,today august 6th be the 70th anniversary of abomb little boy be drop on hiroshima70000 kill outright as the city be flatten,1.0
5525,would have just flatten the little midget,0.0
5526,who say this yosemite sam or drumpf ûïnobody û÷ill vote for a flatten out rabbit skin ahuh huh û i always sayû,0.0
5528,grabakahitman izigarcia when he flatten machidadid he lose that fightnope he lose fight to guy he shouldnt of lose to also,1.0
5529,"floored4 flatten 

early bird do get de cup  so lag bout pun de dock and watch ppl drinkû",0.0
5531,conklin be flatten shuffle feet instead of kick slide didnt get hand up into chest,0.0
5532,flatten thee striker,1.0
5534,pick up flatten hay men  masonite in wahpeton nd,0.0
5535,zouma just flatten that guy,0.0
5538,fylde build set to be flatten one of prestonûªs city centre iconic build be disappear from the skyline,0.0
5539,iamhorsefly hide your kid hide your wife hes on the loose i think i flatten you with a ball,0.0
5540,wouldve be great if mbiwa just flatten that little rat,0.0
5541,jimmozel puckflattened ball lol,0.0
5544,i dont doubt it but it be his implicit statement in do it that make me want him flatten by a bus,0.0
5545,kainyusanagi grummz pixelcanuck and flatten raynor  raynor be a bald imperfect biker marine not a emo generic western hero,0.0
5547,seanpeconi jasonfloyd lynchonsports criscyborg i think the risk of lose and get her nose flatten have a lot to do with it,0.0
5548,mums literally just pick up her new car today and flatten the battery already try to sort out the bluetooth  muppet,0.0
5552,"tweetinglew tersestuff 

notley flatten harper in his heartland
harper import tens of thousands of tfw slave cost albertans job",0.0
5553,twilightfairy flatten frog,0.0
5554,imagine get flatten by kurt zouma,0.0
5555,the fallacy be it be up to the steam roller its up to the object whether it will be flatten or not robertcalifornia thereisonlysex,0.0
5556,photo beach earrings beach jewelry vacation earrings keep calm and beach on earrings make with flatten,0.0
5557,100  1 mix new flat double side linerless bottle cap you choose mix flatten  full reû,0.0
5558,bigburgerboi55 flat footballs more like he flatten the spartans from crush them back in the day hail,0.0
5559,satanaofhell ever see by far a dreamy look come over his face and his ears flatten as he start to walk slowly toward her youd,1.0
5560,100  1 mix new flat double side linerless bottle cap you choose mix flatten  full reû,0.0
5561,when fizzy be sit in the regular flood seat  and no one know who she be,0.0
5563,jkl cancel flash flood warn for bell harlan knox ky   wx,1.0
5564,spot flood combo 53inch 300w curve cree lead work light bar 4x4 offroad fog lamp  full reû,1.0
5565,spot flood combo 53inch 300w curve cree lead work light bar 4x4 offroad fog lamp  full reû,0.0
5567,a small flood with bigåêconsequences,1.0
5569,homecoming queen kill on way home from the prom by flood water socialnews,1.0
5570,2pcs 18w cree lead work light  offroad lamp car truck boat mine 4wd flood beam  full reaû,0.0
5573,"its be rain since you leave me
now im drown in the flood
you see ive always be a fighter
but without you i give up",0.0
5575,creationmin rwrabbit gooneratheist atheistic1 lolatjesus yet still why do so many fish die in the worldwide flood i wonder,0.0
5576,and please dont flood poor robertbenglunds mention hes put in his work,1.0
5577,spot flood combo 53inch 300w curve cree lead work light bar 4x4 offroad fog lamp  full reû,0.0
5578,atlarnxx but he didnt,0.0
5579,12 72w cree lead work light bar alloy spot flood combo dive offroad 4wd boat  full readû,0.0
5580,2pcs 18w cree lead work light  offroad lamp car truck boat mine 4wd flood beam  full reaû,1.0
5581,hellotybeeren cue the flood of people ironically call you that,0.0
5582,motor hot deal 452 gtgt  10x 27w 12v 24v lead work light flood lamp tractor truck suv utv aû,0.0
5584,85v265v 10w lead warm white light motion sensor outdoor flood light pir lamp auc,0.0
5586,iembothfo  at 1000 be 2 nnw hana maui co hi county official report coastal flood û,1.0
5587,1 pair new 27w 4  round lead work drive flood light offroad atv utv  full read by ebay,0.0
5588,2pcs 18w cree lead work light  offroad lamp car truck boat mine 4wd flood beam  full reaû,0.0
5589,internet basics the flood defective intertissue be soul mate the milk trench host guabxfv,1.0
5590,bmx issue areal flood advisory for shelby al till aug 5 900 pm cdt,1.0
5592,2pcs 18w cree lead work light  offroad lamp car truck boat mine 4wd flood beam  full reaû,0.0
5593,flood advisory in effect for shelby county in al until 9 pm alwx,1.0
5594,rt grantfactory grant fund weymouth meet on seawalls and flood grant set for thursday night û,1.0
5595,spot flood combo 53inch 300w curve cree lead work light bar 4x4 offroad fog lamp  full reû,0.0
5598,spot flood combo 53inch 300w curve cree lead work light bar 4x4 offroad fog lamp  full reû,0.0
5599,spot flood combo 53inch 300w curve cree lead work light bar 4x4 offroad fog lamp  full reû,0.0
5600,flood advisory issue august 05 at 428pm edt by nws  wxky,1.0
5602,"survive the plague
floated the flood
just peek our head above the mud
no ones immune
deafening bells
my god will we survive ourselves",0.0
5603,spot flood combo 53inch 300w curve cree lead work light bar 4x4 offroad fog lamp  full reû,0.0
5604,flood prone waterways in westchester county now eligible for millions in state aid newyork,1.0
5605,chinese rescue team arrive in myanmar to help flood victims  sittway,1.0
5608,flood advisory issue august 05 at 710pm cdt until august 05 at 800pm cdt by nws the urban and   weather,1.0
5609,12 72w cree lead work light bar alloy spot flood combo dive offroad 4wd boat  full readû,0.0
5611,rock spring ûò residents live off elk street continue to battle flood issue after mondayûªs rain storm whileû,1.0
5612,cuban leader extend sympathy to vietnam over flood at,1.0
5613,business at the sponge dock wash out by rain flood,1.0
5614,warlordqueen he thrust a little more before he jam his cock deep inside her flood her womb and pussy with his hot thick cum,0.0
5617,severe thunderstorms and flash flood possible in the midsouth and midwest  weather environment climate nature,1.0
5618,1130a radar update widespread showersstorms but move over the same areasminor flood possible hunwx,1.0
5619,tip to prevent basement leak  create control joint to eliminate random crack homeimprovement flood,0.0
5620,flood,1.0
5621,adorableappple no report flood po in the area ten4 mmda,0.0
5622,flood kill 166 displace over one million in pakistan  daily news amp analysis  yugvani,1.0
5624,flood kill 166 displace over one million in pakistan  daily news amp analysis,1.0
5625,laos flood 10 villages underwater world vision respond,1.0
5626,flood ukfloods  british trekkers rescue amid flash flood in himalayas a group of british tr   flood,1.0
5627,slopeofhope maybe the plan be to dilute until they can safely say we have to start charge or its over long would come flood in,0.0
5628,cuban leader extend sympathy to vietnam over flood at,1.0
5629,ill only dm hotel info because people be flood my notifications ask me for info,0.0
5631,"when the wave be flood the shore
and i cant find my way home anymore
thats when i look at you",1.0
5632,if flood occur in your home  how to stop mold growth via proudgreenhome,1.0
5633,flood of track cause derailment sa insubcontinent insubcontinent,1.0
5634,the chinese be flood nyc market like never before,0.0
5635,obama keep 27 iraqi christian asylum seekers ndetention while flood us wunscreened muslims  via dcclothesline,1.0
5638,so grateful for all the support flood in from netkicorp dinner guests thank you all,1.0
5641,there some flash flood in madison valleywx,1.0
5642,themaine be it too soon to start flood your comment section with come to brazil comment bc i will,0.0
5644,and last year it be just a lot of the drum be flood and janice im fall,0.0
5645,ûïbbcengland a burst water main cause major flood at a birmingham hospital   omg,1.0
5646,heavy rainfall and flood in northern vietnam  situation report no2,1.0
5647,crabbycale oh my god the memories be flood back,0.0
5650,flood disaster burst water pipe flood apartments at nycha senior center  ny1 ny1burst water pipe flood a,1.0
5651,lrt look at all my tom feel flood back,0.0
5652,myanmar msf assist thousands as worst flood in decades hit part of myanmar,1.0
5653,residents in the central part of ocean city hear from engineer about flood mitigation options tuesday ocnj,1.0
5654,wen i finally get the girl i want im flood yall wit all pics of us rs tho,0.0
5655,kwislo i see her flood at mad decent,0.0
5656,monsoon flood kill dozens in myanmar prompt call for help,1.0
5657,memorial unveil for travis county deputy kill in sept flood travis county sheriff greg hamilton joinedû,1.0
5658,"flood kill 166 displace over one million in pakistan 

at least 166 people have be kill and nearly 11 lakhû",1.0
5659,thankkk u all soo much for flood my notificationsu my fella parsholics r superb amp jus soo awesomelove love u all always frvrgrateful,0.0
5661,slip slide away  flash flood info for writers wtony nester sonoranrattler writingtips,1.0
5662,"who be bring the tornadoes and flood who be bring the climate change god be after america he be plague her
 
farrakhan quote",1.0
5663,myanmar flood heavy monsoon rain during the month of july have cause flood flash flood and landsli,1.0
5664,in india 119000 people have take shelter in the 966 relief camp the government have set up after the flood,1.0
5665,pmharper dont worry im sure climate have nothing to do with hail flood tornados in alberta amp ontario im sure gods just mad at you,1.0
5668,"ictyosaur i never think it would be a wtf moment yet its here after months of 90 degree heat
next we will have flash flood",1.0
5669,grant like half my town flood when it rain but still whatever,1.0
5670,madonnamking rspca site multiple 7 story high rise build next to low density character residential in an area that flood,0.0
5671,cyberdemon531 i hope that mountain dew erode your throat and flood your lungs leave you to drown to death,1.0
5672,disaster group stun by flood,1.0
5673,theres this person amp they reckon when youre die your brain flood with dmt cause you to relive your life in real time in a simulation,0.0
5674,have you ever remember an old song something you havent hear for years  word that carry flood of memories all along priceless,0.0
5675,flood fish finally sunshine amp fab deal from albertsons anniversary sale lauren paint  a beautiful life,0.0
5676,flood disaster bengal flood cm mamata banerjee blame dvc bjp claim state fail to use   economic t,1.0
5677,69 dead due to flood in myanmar naypyidaw aug 5 prensa latina the death toll rise today to 69 in myanmar,1.0
5680,typhoon soudelor approach after 7 kill 2 miss in flood in philippines  via abc7chicago,1.0
5683,casewrites when it rain in nj it flash flood otherwise its just a desert of grief and tax,1.0
5684,download  itunes  flood of glory by luiz santos jazz art music,0.0
5685,contactenergy yep during flood of 1999 or 2000  clyde dam release every bite of water it could most speccy  ev charge your way,1.0
5686,bamenda flood kill animals bird,1.0
5687,i hope it rain throughout the whole weekend i hope it flood and the portaloos become sentient,0.0
5688,apc chieftain task dickson on n15b flood donation to bayelsa,1.0
5689,pagasa 712am yellow warn  panay island guimaras negros possible flood in lowlying areas amp landslides in mountainous areas,1.0
5690,rt 40hourfamine in bangladesh government have not declare flood an emergency worldvision will continue to mû,1.0
5692,nearly 50 thousand people affect by flood in paraguay,1.0
5693,etp bengal flood cm mamata banerjee blame dvc bjp claim state fail to use relief fund even as flood w,1.0
5694,may allah help all those suffer from the pakistan flood you and your families be in our dua,1.0
5695,children in myanmar face a double catastrophe as flood hit the most,1.0
5698,love when drake flood instagram make you feel real in tune with everything he do like you be there or sumn,0.0
5699,"who be bring the tornadoes and flood who be bring the climate change god be after america he be plague her
 
farrakhan quote",0.0
5703,69 die in myanmar flood 250000 affect,1.0
5704,typhoon soudelor approach after 7 kill 2 miss in flood in philippinesû  typhoon,1.0
5705,memphis always flood,1.0
5706,flood cause damage and death across asia  all media content    05082015,1.0
